[
    {
      "subject": "ACTION: Submit Timesheets by Friday",
      "bluf_tag": "ACTION:",
      "bluf_summary": "Timesheets must be submitted by Friday so payroll can be processed. Please ensure all staff complete their entries before the deadline.",
      "email": "Bottom Line Up Front\n\nPurpose: ACTION:\n\nTimesheets must be submitted by Friday so payroll can be processed. Please ensure all staff complete their entries before the deadline.\n\nHi team, just reminding everyone that timesheets for this week are due on Friday. Please make sure to submit them by then so payroll can be processed."
    }
  ]
   